{
  "$schema": "https://json-schema.org/draft/2020-12/schema",
  "title": "MissionConfig",
  "type": "object",
  "required": ["mission_id", "behavior", "vehicles", "objective"],
  "properties": {
    "schema_version": {"type": "string"},
    "mission_id": {"type": "string"},
    "phase": {"type": "integer", "minimum": 0},
    "name": {"type": "string"},
    "behavior": {"type": "integer", "enum": [0, 1, 2]},
    "vehicles": {
      "type": "array",
      "items": {"type": "string"},
      "minItems": 1
    },
    "required_capabilities": {
      "type": "array",
      "items": {"type": "string"},
      "uniqueItems": true
    },
    "payload_action": {
      "type": "object",
      "required": ["type", "payload"],
      "properties": {
        "type": {"type": "string", "enum": ["pickup", "dropoff"]},
        "payload": {"type": "string"}
      }
    },
    "start": {
      "type": "object",
      "properties": {
        "geometry": {"$ref": "#/$defs/geometryRef"},
        "tolerance_distance": {"type": "number", "minimum": 0},
        "vehicle_formation": {"type": "integer", "enum": [0, 1, 2, 3, 4, 5, 6]},
        "vehicle_formation_distance": {"type": "number", "exclusiveMinimum": 0},
        "vehicle_orientation": {"type": "array", "items": {"type": "number"}, "minItems": 1},
        "maximize_coverage": {"type": "boolean"},
        "start_time": {"$ref": "#/$defs/timeWindow"}
      }
    },
    "transit": {
      "type": "object",
      "properties": {
        "geofence": {"$ref": "#/$defs/geometryRef"},
        "geofence_maximize_coverage": {"type": "boolean"},
        "roads": {"type": "array", "items": {"$ref": "#/$defs/geometryRef"}},
        "vehicle_formation": {"type": "integer", "enum": [0, 1, 2, 3, 4, 5, 6]},
        "vehicle_formation_distance": {"type": "number", "exclusiveMinimum": 0},
        "optimization": {
          "type": "object",
          "properties": {
            "visibility": {"type": "number", "minimum": 0, "maximum": 1},
            "energy": {"type": "number", "minimum": 0, "maximum": 1},
            "road_usage": {"type": "number", "minimum": 0, "maximum": 1}
          }
        },
        "desired_vehicle_constraints": {
          "type": "object",
          "properties": {
            "max_speed": {"type": "number", "exclusiveMinimum": 0},
            "max_acceleration": {"type": "number", "minimum": 0},
            "max_jerk": {"type": "number", "minimum": 0},
            "max_deceleration": {"type": "number", "minimum": 0},
            "max_straight_slope": {"type": "number", "minimum": 0},
            "max_side_slope": {"type": "number", "minimum": 0}
          }
        }
      }
    },
    "objective": {
      "type": "object",
      "required": ["geometries"],
      "properties": {
        "geometries": {
          "type": "array",
          "items": {"$ref": "#/$defs/geometryRef"},
          "minItems": 1
        },
        "minimum_distance": {"type": "number"},
        "maximum_distance": {"type": "number"},
        "vehicle_formation": {"type": "integer", "enum": [0, 1, 2, 3, 4, 5, 6]},
        "vehicle_formation_distance": {"type": "number"},
        "vehicle_orientation": {"type": "array", "items": {"type": "number"}},
        "vehicle_orientation_origin": {"$ref": "#/$defs/geometryRef"},
        "vehicle_order": {"type": "boolean"},
        "line_of_sight": {"$ref": "#/$defs/geometryRef"},
        "line_of_sight_propagation": {"type": "boolean"},
        "maximize_coverage": {"type": "boolean"},
        "maximum_coverage_distances": {
          "type": "array",
          "description": "Maximum separation in metres between vehicles distributed over the objective: one shared value or one value per mission vehicle.",
          "items": {"type": "number", "exclusiveMinimum": 0},
          "minItems": 1
        },
        "coverage_swath_widths": {
          "type": "array",
          "description": "Sensor-derived coverage swath widths in metres. Normally injected from the selected world vehicle profiles.",
          "items": {"type": "number", "exclusiveMinimum": 0},
          "minItems": 1
        },
        "arrival_time": {"$ref": "#/$defs/timeWindow"}
      }
    },
    "mission_end_time": {"type": "string"}
  },
  "$defs": {
    "geometryRef": {
      "type": "object",
      "oneOf": [
        {"required": ["feature_id"]},
        {"required": ["geometry"]}
      ],
      "properties": {
        "feature_id": {"type": "string"},
        "geometry": {"$ref": "#/$defs/inlineGeometry"}
      }
    },
    "position": {
      "type": "array",
      "prefixItems": [
        {"type": "number", "minimum": -180, "maximum": 180},
        {"type": "number", "minimum": -90, "maximum": 90}
      ],
      "items": false,
      "minItems": 2,
      "maxItems": 2
    },
    "inlineGeometry": {
      "type": "object",
      "required": ["geometry_type", "coordinates"],
      "oneOf": [
        {
          "properties": {
            "geometry_type": {"const": "Point"},
            "coordinates": {"$ref": "#/$defs/position"}
          }
        },
        {
          "properties": {
            "geometry_type": {"const": "MultiPoint"},
            "coordinates": {
              "type": "array",
              "items": {"$ref": "#/$defs/position"},
              "minItems": 1
            }
          }
        },
        {
          "properties": {
            "geometry_type": {"const": "LineString"},
            "coordinates": {
              "type": "array",
              "items": {"$ref": "#/$defs/position"},
              "minItems": 2
            }
          }
        },
        {
          "properties": {
            "geometry_type": {"const": "Polygon"},
            "coordinates": {
              "type": "array",
              "items": {
                "type": "array",
                "items": {"$ref": "#/$defs/position"},
                "minItems": 4
              },
              "minItems": 1,
              "maxItems": 1
            }
          }
        }
      ]
    },
    "timeWindow": {
      "type": "object",
      "required": ["earliest", "target", "latest"],
      "properties": {
        "earliest": {"type": "string"},
        "target": {"type": "string"},
        "latest": {"type": "string"}
      }
    }
  }
}
